<!--
 Copyright (c) 2006-2010 by Public Library of Science
 http://plos.org
 http://ambraproject.org
  
  Licensed under the Apache License, Version 2.0 (the "License");
  you may not use this file except in compliance with the License.
  You may obtain a copy of the License at
  
  http://www.apache.org/licenses/LICENSE-2.0
  
  Unless required by applicable law or agreed to in writing, software
  distributed under the License is distributed on an "AS IS" BASIS,
  WITHOUT WARRANTIES OR CONDITIONS OF ANY KIND, either express or implied.
  See the License for the specific language governing permissions and
  limitations under the License.
-->
<!--
  - This is the DTD of the manifest. A submission information package (SIP) is a zip archive
  - with a manifest; the manifest is an entry called "manifest.xml" which must conform to
  - this DTD.
  -->

<!ELEMENT manifest (articleBundle) >

<!ELEMENT articleBundle (article, object*) >

<!-- the article. 'main-entry' specifies the zip entry that contains the nlm
   - article xml; this must match one of the contained representations
   -->
<!ELEMENT article (representation+) >
<!ATTLIST article
    uri         CDATA          #REQUIRED 
    main-entry  CDATA          #REQUIRED >

<!-- all included secondary objects (images, movies, data, etc) -->
<!ELEMENT object (representation+) >
<!ATTLIST object
    uri         CDATA          #REQUIRED 
    strkImage   CDATA          #IMPLIED          >

<!-- a specific representation.
   - 'name' is the name (label) to store this representation under;
   - 'entry' specifies the entry in the zip that contains this representation
   -->
<!ELEMENT representation EMPTY >
<!ATTLIST representation
    name        CDATA          #REQUIRED 
    entry       CDATA          #REQUIRED >



<!-- Example:
<?xml version="1.0" encoding="UTF-8"?>
<!DOCTYPE manifest SYSTEM "manifest.dtd">
<manifest>
  <articleBundle>
    <article uri="info:doi/10.1371/journal.foo.00042" main-entry="my-article.xml">
      <representation name="XML" entry="my-article.xml"/>
      <representation name="PDF" entry="my-article.pdf"/>
    </article>
    <object uri="info:doi/10.1371/journal.foo.00042.g001" strkImage="True">
      <representation name="PNG_S" entry="image01.small.png"/>
      <representation name="PNG_L" entry="image01.large.png"/>
    </object>
    <object uri="info:doi/10.1371/journal.foo.00042.g002">
      <representation name="PNG_S" entry="image02.small.png"/>
      <representation name="TIFF"  entry="image02.tiff"/>
    </object>
  </articleBundle>
</manifest>
-->
