<?xml version="1.0" encoding="utf-8"?>
<!DOCTYPE manifest SYSTEM "manifest.dtd">
<manifest>
 <articleBundle>
  <article uri="info:doi/10.24196/journal.aarx.2001421">
   <representation entry="aarx.2001421.xml" key="10.24196/journal.aarx.2001421.XML" mimetype="application/xml" type="manuscript"/>
   <representation entry="aarx.2001421.pdf" key="10.24196/journal.aarx.2001421.pdf" mimetype="application/pdf" type="printable"/>
  </article>
  <object type="supplementaryMaterial" uri="info:doi/10.24196/journal.aarx.2001421.s001">
   <representation entry="aarx.2001421.s001.xlsx" key="10.24196/journal.aarx.2001421.s001.xlsx" mimetype="application/vnd.openxmlformats-officedocument.spreadsheetml.sheet" type="supplementary"/>
  </object>
  <object type="supplementaryMaterial" uri="info:doi/10.24196/journal.aarx.2001421.s002">
   <representation entry="aarx.2001421.s002.tif" key="10.24196/journal.aarx.2001421.s002.tif" mimetype="image/tiff" type="supplementary"/>
  </object>
  <object type="supplementaryMaterial" uri="info:doi/10.24196/journal.aarx.2001421.s003">
   <representation entry="aarx.2001421.s003.xlsx" key="10.24196/journal.aarx.2001421.s003.xlsx" mimetype="application/vnd.openxmlformats-officedocument.spreadsheetml.sheet" type="supplementary"/>
  </object>
  <object type="supplementaryMaterial" uri="info:doi/10.24196/journal.aarx.2001421.s004">
   <representation entry="aarx.2001421.s004.tif" key="10.24196/journal.aarx.2001421.s004.tif" mimetype="image/tiff" type="supplementary"/>
  </object>
  <object type="supplementaryMaterial" uri="info:doi/10.24196/journal.aarx.2001421.s005">
   <representation entry="aarx.2001421.s005.xlsx" key="10.24196/journal.aarx.2001421.s005.xlsx" mimetype="application/vnd.openxmlformats-officedocument.spreadsheetml.sheet" type="supplementary"/>
  </object>
  <object type="supplementaryMaterial" uri="info:doi/10.24196/journal.aarx.2001421.s006">
   <representation entry="aarx.2001421.s006.xlsx" key="10.24196/journal.aarx.2001421.s006.xlsx" mimetype="application/vnd.openxmlformats-officedocument.spreadsheetml.sheet" type="supplementary"/>
  </object>
  <object type="supplementaryMaterial" uri="info:doi/10.24196/journal.aarx.2001421.s007">
   <representation entry="aarx.2001421.s007.xlsx" key="10.24196/journal.aarx.2001421.s007.xlsx" mimetype="application/vnd.openxmlformats-officedocument.spreadsheetml.sheet" type="supplementary"/>
  </object>
  <object type="supplementaryMaterial" uri="info:doi/10.24196/journal.aarx.2001421.s008">
   <representation entry="aarx.2001421.s008.xlsx" key="10.24196/journal.aarx.2001421.s008.xlsx" mimetype="application/vnd.openxmlformats-officedocument.spreadsheetml.sheet" type="supplementary"/>
  </object>
  <object type="supplementaryMaterial" uri="info:doi/10.24196/journal.aarx.2001421.s009">
   <representation entry="aarx.2001421.s009.xlsx" key="10.24196/journal.aarx.2001421.s009.xlsx" mimetype="application/vnd.openxmlformats-officedocument.spreadsheetml.sheet" type="supplementary"/>
  </object>
  <object type="supplementaryMaterial" uri="info:doi/10.24196/journal.aarx.2001421.s010">
   <representation entry="aarx.2001421.s010.xlsx" key="10.24196/journal.aarx.2001421.s010.xlsx" mimetype="application/vnd.openxmlformats-officedocument.spreadsheetml.sheet" type="supplementary"/>
  </object>
  <object type="supplementaryMaterial" uri="info:doi/10.24196/journal.aarx.2001421.s011">
   <representation entry="aarx.2001421.s011.xlsx" key="10.24196/journal.aarx.2001421.s011.xlsx" mimetype="application/vnd.openxmlformats-officedocument.spreadsheetml.sheet" type="supplementary"/>
  </object>
  <object type="supplementaryMaterial" uri="info:doi/10.24196/journal.aarx.2001421.s012">
   <representation entry="aarx.2001421.s012.jpg" key="10.24196/journal.aarx.2001421.s012.jpg" mimetype="image/jpeg" type="supplementary"/>
  </object>
  <object type="supplementaryMaterial" uri="info:doi/10.24196/journal.aarx.2001421.s013">
   <representation entry="aarx.2001421.s013.xlsx" key="10.24196/journal.aarx.2001421.s013.xlsx" mimetype="application/vnd.openxmlformats-officedocument.spreadsheetml.sheet" type="supplementary"/>
  </object>
  <object type="supplementaryMaterial" uri="info:doi/10.24196/journal.aarx.2001421.s014">
   <representation entry="aarx.2001421.s014.jpg" key="10.24196/journal.aarx.2001421.s014.jpg" mimetype="image/jpeg" type="supplementary"/>
  </object>
  <object type="supplementaryMaterial" uri="info:doi/10.24196/journal.aarx.2001421.s015">
   <representation entry="aarx.2001421.s015.xlsx" key="10.24196/journal.aarx.2001421.s015.xlsx" mimetype="application/vnd.openxmlformats-officedocument.spreadsheetml.sheet" type="supplementary"/>
  </object>
  <object type="supplementaryMaterial" uri="info:doi/10.24196/journal.aarx.2001421.s016">
   <representation entry="aarx.2001421.s016.tif" key="10.24196/journal.aarx.2001421.s016.tif" mimetype="image/tiff" type="supplementary"/>
  </object>
  <object type="supplementaryMaterial" uri="info:doi/10.24196/journal.aarx.2001421.s017">
   <representation entry="aarx.2001421.s017.xlsx" key="10.24196/journal.aarx.2001421.s017.xlsx" mimetype="application/vnd.openxmlformats-officedocument.spreadsheetml.sheet" type="supplementary"/>
  </object>
  <object type="supplementaryMaterial" uri="info:doi/10.24196/journal.aarx.2001421.s018">
   <representation entry="aarx.2001421.s018.tif" key="10.24196/journal.aarx.2001421.s018.tif" mimetype="image/tiff" type="supplementary"/>
  </object>
  <object type="supplementaryMaterial" uri="info:doi/10.24196/journal.aarx.2001421.s019">
   <representation entry="aarx.2001421.s019.xlsx" key="10.24196/journal.aarx.2001421.s019.xlsx" mimetype="application/vnd.openxmlformats-officedocument.spreadsheetml.sheet" type="supplementary"/>
  </object>
  <object type="supplementaryMaterial" uri="info:doi/10.24196/journal.aarx.2001421.s020">
   <representation entry="aarx.2001421.s020.tif" key="10.24196/journal.aarx.2001421.s020.tif" mimetype="image/tiff" type="supplementary"/>
  </object>
  <object type="supplementaryMaterial" uri="info:doi/10.24196/journal.aarx.2001421.s021">
   <representation entry="aarx.2001421.s021.xlsx" key="10.24196/journal.aarx.2001421.s021.xlsx" mimetype="application/vnd.openxmlformats-officedocument.spreadsheetml.sheet" type="supplementary"/>
  </object>
  <object type="supplementaryMaterial" uri="info:doi/10.24196/journal.aarx.2001421.s022">
   <representation entry="aarx.2001421.s022.tif" key="10.24196/journal.aarx.2001421.s022.tif" mimetype="image/tiff" type="supplementary"/>
  </object>
  <object type="supplementaryMaterial" uri="info:doi/10.24196/journal.aarx.2001421.s023">
   <representation entry="aarx.2001421.s023.xlsx" key="10.24196/journal.aarx.2001421.s023.xlsx" mimetype="application/vnd.openxmlformats-officedocument.spreadsheetml.sheet" type="supplementary"/>
  </object>
  <object type="supplementaryMaterial" uri="info:doi/10.24196/journal.aarx.2001421.s024">
   <representation entry="aarx.2001421.s024.tif" key="10.24196/journal.aarx.2001421.s024.tif" mimetype="image/tiff" type="supplementary"/>
  </object>
  <object type="supplementaryMaterial" uri="info:doi/10.24196/journal.aarx.2001421.s025">
   <representation entry="aarx.2001421.s025.xlsx" key="10.24196/journal.aarx.2001421.s025.xlsx" mimetype="application/vnd.openxmlformats-officedocument.spreadsheetml.sheet" type="supplementary"/>
  </object>
  <object type="supplementaryMaterial" uri="info:doi/10.24196/journal.aarx.2001421.s026">
   <representation entry="aarx.2001421.s026.tif" key="10.24196/journal.aarx.2001421.s026.tif" mimetype="image/tiff" type="supplementary"/>
  </object>
 </articleBundle>
 <ancillary>
  <file entry="manifest.xml" key="10.24196/journal.aarx.2001421.manifest.xml" mimetype="application/xml"/>
  <file entry="manifest.dtd" key="10.24196/journal.aarx.2001421.manifest.dtd" mimetype="application/xml-dtd"/>
  <file entry="aarx.2001421.xml.orig" key="10.24196/journal.aarx.2001421.xml.orig" mimetype="application/xml"/>
 </ancillary>
</manifest>